{
  "$schema": "https://json-schema.org/draft/2020-12/schema",
  "$id": "https://schema.kya-os.org/v1/protocol/delegation/credential/v1.0.0",
  "title": "KYA-OS Delegation Credential",
  "description": "W3C Verifiable Credential containing a KYA-OS delegation with CRISP constraints.",
  "type": "object",
  "required": ["@context", "type", "issuer", "issuanceDate", "credentialSubject"],
  "properties": {
    "@context": {
      "type": "array",
      "items": {
        "oneOf": [
          { "type": "string", "format": "uri" },
          { "type": "object" }
        ]
      },
      "minItems": 2,
      "description": "JSON-LD context. MUST include W3C VC context as first element and KYA-OS delegation context."
    },
    "id": {
      "type": "string",
      "format": "uri",
      "description": "Unique credential identifier (URN or URL)."
    },
    "type": {
      "type": "array",
      "items": { "type": "string" },
      "contains": { "const": "VerifiableCredential" },
      "minItems": 2,
      "description": "Credential types. MUST include 'VerifiableCredential' and 'DelegationCredential'."
    },
    "issuer": {
      "oneOf": [
        { "type": "string", "pattern": "^did:.+$" },
        {
          "type": "object",
          "required": ["id"],
          "properties": {
            "id": { "type": "string", "pattern": "^did:.+$" }
          }
        }
      ],
      "description": "Issuer DID or issuer object containing id."
    },
    "issuanceDate": {
      "type": "string",
      "format": "date-time",
      "description": "ISO 8601 datetime when the credential was issued."
    },
    "expirationDate": {
      "type": "string",
      "format": "date-time",
      "description": "ISO 8601 datetime when the credential expires."
    },
    "credentialSubject": {
      "$ref": "#/$defs/DelegationCredentialSubject"
    },
    "credentialStatus": {
      "$ref": "#/$defs/CredentialStatus"
    },
    "proof": {
      "$ref": "#/$defs/Proof"
    }
  },
  "additionalProperties": true,
  "$defs": {
    "DelegationCredentialSubject": {
      "type": "object",
      "required": ["id", "delegation"],
      "properties": {
        "id": {
          "type": "string",
          "pattern": "^did:.+$",
          "description": "Subject DID (the delegate receiving the authorization)."
        },
        "delegation": {
          "type": "object",
          "required": ["id", "issuerDid", "subjectDid", "constraints", "status"],
          "properties": {
            "id": {
              "type": "string",
              "description": "Unique delegation identifier."
            },
            "issuerDid": {
              "type": "string",
              "pattern": "^did:.+$",
              "description": "DID of the delegation issuer (delegator)."
            },
            "subjectDid": {
              "type": "string",
              "pattern": "^did:.+$",
              "description": "DID of the delegation subject (delegate)."
            },
            "userDid": {
              "type": "string",
              "pattern": "^did:.+$",
              "description": "DID of the end user whose delegated authority the agent exercises."
            },
            "userIdentifier": {
              "type": "string",
              "description": "Alternative user identifier (e.g., email, username)."
            },
            "sessionId": {
              "type": "string",
              "description": "Session binding for session-scoped delegations."
            },
            "scopes": {
              "type": "array",
              "items": { "type": "string" },
              "description": "Authorized scope strings."
            },
            "controller": {
              "type": "string",
              "pattern": "^did:.+$",
              "description": "Controller DID for delegation management."
            },
            "parentId": {
              "type": "string",
              "description": "Parent delegation ID for chained delegations."
            },
            "constraints": {
              "$ref": "#/$defs/DelegationConstraints"
            },
            "status": {
              "type": "string",
              "enum": ["active", "revoked", "expired"],
              "description": "Current delegation status."
            },
            "createdAt": {
              "type": "integer",
              "description": "Unix timestamp when delegation was created."
            },
            "metadata": {
              "type": "object",
              "description": "Additional delegation metadata.",
              "additionalProperties": true
            }
          },
          "additionalProperties": true
        }
      }
    },
    "DelegationConstraints": {
      "type": "object",
      "properties": {
        "notBefore": {
          "type": "integer",
          "description": "Unix timestamp before which the delegation is not valid."
        },
        "notAfter": {
          "type": "integer",
          "description": "Unix timestamp after which the delegation expires."
        },
        "scopes": {
          "type": "array",
          "items": { "type": "string" },
          "description": "Authorized scope strings."
        },
        "audience": {
          "oneOf": [
            { "type": "string" },
            { "type": "array", "items": { "type": "string" } }
          ],
          "description": "Intended audience DID(s) for the delegation."
        },
        "crisp": {
          "type": "object",
          "required": ["scopes"],
          "properties": {
            "budget": {
              "type": "object",
              "required": ["unit", "cap"],
              "properties": {
                "unit": {
                  "type": "string",
                  "enum": ["USD", "ops", "points"],
                  "description": "Budget unit type."
                },
                "cap": {
                  "type": "number",
                  "minimum": 0,
                  "description": "Maximum budget amount."
                },
                "window": {
                  "type": "object",
                  "required": ["kind", "durationSec"],
                  "properties": {
                    "kind": {
                      "type": "string",
                      "enum": ["rolling", "fixed"]
                    },
                    "durationSec": {
                      "type": "integer",
                      "minimum": 1
                    }
                  }
                }
              }
            },
            "scopes": {
              "type": "array",
              "items": {
                "type": "object",
                "required": ["resource", "matcher"],
                "properties": {
                  "resource": { "type": "string" },
                  "matcher": {
                    "type": "string",
                    "enum": ["exact", "prefix", "path-prefix", "regex"]
                  },
                  "constraints": {
                    "type": "object",
                    "additionalProperties": true
                  }
                }
              }
            }
          },
          "additionalProperties": true
        }
      },
      "additionalProperties": true
    },
    "CredentialStatus": {
      "type": "object",
      "required": ["id", "type", "statusPurpose", "statusListIndex", "statusListCredential"],
      "properties": {
        "id": {
          "type": "string",
          "format": "uri",
          "description": "Status entry identifier."
        },
        "type": {
          "type": "string",
          "const": "StatusList2021Entry"
        },
        "statusPurpose": {
          "type": "string",
          "enum": ["revocation", "suspension"]
        },
        "statusListIndex": {
          "type": "string",
          "pattern": "^[0-9]+$",
          "description": "Index in the status list bitstring."
        },
        "statusListCredential": {
          "type": "string",
          "format": "uri",
          "description": "URL of the StatusList2021 credential."
        }
      }
    },
    "Proof": {
      "type": "object",
      "required": ["type"],
      "properties": {
        "type": {
          "type": "string",
          "description": "Proof type (e.g., 'Ed25519Signature2020', 'JsonWebSignature2020')."
        },
        "created": {
          "type": "string",
          "format": "date-time"
        },
        "verificationMethod": {
          "type": "string",
          "description": "DID URL of the verification key."
        },
        "proofPurpose": {
          "type": "string",
          "description": "Purpose of the proof (e.g., 'assertionMethod')."
        },
        "proofValue": {
          "type": "string",
          "description": "Base64-encoded signature value."
        },
        "jws": {
          "type": "string",
          "description": "Compact JWS signature."
        }
      },
      "additionalProperties": true
    }
  },
  "examples": [
    {
      "@context": [
        "https://www.w3.org/2018/credentials/v1",
        "https://schema.kya-os.org/v1/protocol/delegation/context/v1.0.0"
      ],
      "id": "urn:uuid:12345678-1234-1234-1234-123456789abc",
      "type": ["VerifiableCredential", "DelegationCredential"],
      "issuer": "did:key:z6MkhaXgBZDvotDkL5257faiztiGiC2QtKLGpbnnEGta2doK",
      "issuanceDate": "2024-03-12T00:00:00Z",
      "expirationDate": "2024-03-13T00:00:00Z",
      "credentialSubject": {
        "id": "did:key:z6MkpTHR8VNsBxYAAWHut2Geadd9jSwuBV8xRoAnwWsdvktH",
        "delegation": {
          "id": "del-001",
          "issuerDid": "did:key:z6MkhaXgBZDvotDkL5257faiztiGiC2QtKLGpbnnEGta2doK",
          "subjectDid": "did:key:z6MkpTHR8VNsBxYAAWHut2Geadd9jSwuBV8xRoAnwWsdvktH",
          "scopes": ["read:documents", "write:documents"],
          "constraints": {
            "notBefore": 1710201600,
            "notAfter": 1710288000
          },
          "status": "active"
        }
      }
    }
  ]
}
