{
  "@context": [
    "https://www.w3.org/2018/credentials/v1",
    "https://schema.kya-os.org/v1/protocol/delegation/context/v1.0.0"
  ],
  "id": "urn:uuid:revoked-example-777-1786653527770",
  "type": [
    "VerifiableCredential",
    "DelegationCredential"
  ],
  "issuer": "did:cheqd:testnet:17bc59fe-2e93-4e01-8613-c7c4560adcf2",
  "issuanceDate": "2026-08-13T20:38:47.770Z",
  "expirationDate": "2036-08-10T20:38:47.000Z",
  "credentialSubject": {
    "id": "did:key:z6Mkm4qc7NykwaqCzDjTjArmjuUsvcE9Xzfk28frpGtUdxiM",
    "delegation": {
      "id": "revoked-example-777-1786653527770",
      "issuerDid": "did:cheqd:testnet:17bc59fe-2e93-4e01-8613-c7c4560adcf2",
      "subjectDid": "did:key:z6Mkm4qc7NykwaqCzDjTjArmjuUsvcE9Xzfk28frpGtUdxiM",
      "scopes": [
        "payments.transfer"
      ],
      "constraints": {
        "scopes": [
          "payments.transfer"
        ],
        "notBefore": 1786653467,
        "notAfter": 2102013527,
        "crisp": {
          "scopes": [
            {
              "resource": "payments.transfer",
              "matcher": "exact",
              "constraints": {
                "maxAmountNcheq": "10000000000",
                "denom": "ncheq",
                "network": "cheqd-testnet"
              }
            }
          ]
        }
      },
      "status": "active",
      "createdAt": 1786653527770,
      "metadata": {
        "tool": "wallet_send",
        "event": "revoked-example"
      }
    }
  },
  "credentialStatus": {
    "id": "https://resolver.cheqd.net/1.0/identifiers/did:cheqd:testnet:17bc59fe-2e93-4e01-8613-c7c4560adcf2?resourceName=kya-statuslist-demo&resourceType=StatusListCredential#777",
    "type": "StatusList2021Entry",
    "statusPurpose": "revocation",
    "statusListIndex": "777",
    "statusListCredential": "https://resolver.cheqd.net/1.0/identifiers/did:cheqd:testnet:17bc59fe-2e93-4e01-8613-c7c4560adcf2?resourceName=kya-statuslist-demo&resourceType=StatusListCredential"
  },
  "proof": {
    "type": "Ed25519Signature2020",
    "created": "2026-08-13T20:38:47.771Z",
    "verificationMethod": "did:cheqd:testnet:17bc59fe-2e93-4e01-8613-c7c4560adcf2#key-1",
    "proofPurpose": "assertionMethod",
    "proofValue": "uPgDlvR_NEC5-cUmEMPwXnLltgkZIGTgNts4Nv60ZIjTcHnBZ0PEnBuvw632GRooGTSvmoq7ZmmJMIAotCt5Ag"
  }
}